{
  "$schema": "https://json-schema.org/draft/2020-12/schema",
  "$id": "https://veraxis.example/schemas/role-identity-map.schema.json",
  "type": "object",
  "required": [
    "schema_version",
    "status",
    "principals",
    "infrastructure_authority"
  ],
  "properties": {
    "schema_version": {
      "type": "string"
    },
    "status": {
      "type": "string"
    },
    "principals": {
      "type": "array",
      "minItems": 1
    },
    "infrastructure_authority": {
      "type": "object"
    }
  },
  "additionalProperties": true
}
