{
  "schema_version": "1.0.0",
  "status": "BOOTSTRAP_CANDIDATE_NOT_ACTIVE",
  "principals": [
    {
      "principal_id": "OWNER_EXECUTION_PRINCIPAL_001",
      "github_account": "veraxis-protocol",
      "github_user_id": 261453745,
      "roles": [
        "OWNER",
        "IMPLEMENTER_EXECUTION"
      ],
      "transport_identity": {
        "type": "github_app_authenticated_account",
        "status": "BOUND"
      },
      "signing_identity": {
        "status": "PENDING_BOOTSTRAP_SETUP",
        "fingerprint": null
      },
      "branch_prefixes": {
        "OWNER": [
          "owner/"
        ],
        "IMPLEMENTER_EXECUTION": [
          "evidence/"
        ]
      },
      "path_classes": {
        "OWNER": [
          "owner-decisions/**"
        ],
        "IMPLEMENTER_EXECUTION": [
          "stage-*/**"
        ]
      },
      "effective_from": "BOOTSTRAP",
      "revoked_at": null,
      "notes": "Owner-controlled GitHub principal. Institutional role must not be inferred from username alone."
    },
    {
      "principal_id": "INDEPENDENT_REVIEWER_001",
      "declared_transport_handle": "inventor1975",
      "github_account": "inventor1975",
      "github_user_id": 2254348,
      "roles": [
        "INDEPENDENT_REVIEWER"
      ],
      "transport_identity": {
        "type": "ssh",
        "status": "BOUND",
        "fingerprint": "SHA256:mz1KDWAgn+fNywN14iUx3u/uyVcGoBDy8NLt/IAF6ok",
        "git_transport": "SSH (git@github.com)",
        "api_review_transport": "HTTPS REST API using reviewer-controlled fine-grained authentication"
      },
      "signing_identity": {
        "status": "KEY_CONFIGURED_AUTOSIGN_OFF",
        "algorithm": "ed25519",
        "fingerprint": "F170414DDBB78F231929121175B13F5AEC28313A"
      },
      "branch_prefixes": {
        "INDEPENDENT_REVIEWER": [
          "review/"
        ]
      },
      "path_classes": {
        "INDEPENDENT_REVIEWER": [
          "reviews/**"
        ]
      },
      "effective_from": "REVIEW_LEDGER_REVIEWER_IDENTITY_BINDING_001",
      "revoked_at": null,
      "notes": "Exact reviewer transport identity is owner-bound: GitHub login and numeric user ID captured, SSH public-key fingerprint captured, signing key configured with automatic signing off. No token, credential, private key, or passphrase is persisted here; transport facts only. Reviewer role effectivity is bounded by REVIEW_LEDGER_REVIEWER_IDENTITY_BINDING_001 and is confined to the INDEPENDENT_REVIEWER role over review/ branches and reviews/** paths. Role effectivity is not ledger activation: ledger status remains BOOTSTRAP_CANDIDATE_NOT_ACTIVE and this principal confers no owner, implementer, infrastructure, or bootstrap authority."
    }
  ],
  "infrastructure_authority": {
    "github_accounts": [
      "veraxis-protocol"
    ],
    "branch_prefixes": [
      "infra/"
    ],
    "requires_non_author_independent_review": true,
    "protected_paths": [
      ".github/**",
      "verifier/**",
      "schemas/**",
      "policy/**",
      "CODEOWNERS",
      "ROLE-IDENTITY-MAP.json",
      "LEDGER-INVARIANTS.md"
    ]
  }
}
